nombre,tienda,categoria_principal,precio,moneda,simbolo,estrellas,reviews,descripcion,especificaciones,categoria,categoria_path,url,imagen,sku,id
ROG STRIX X670E-E GAMING WIFI,ASUS,tarjetas madre,,,,0.0,0,"Motherboard AMD  X670 ATX con 18+2+2 fases de poder, soporte DDR5, dos puertos PCIe®  5.0 x16, PCIe Slot Q-Release, cuatro puertos M.2 con disipadores, compatibilidad con PCIe 5.0 SSD NVMe®, disipador combinado M.2, placa posterior M.2, disipador térmico masivo M.2, USB 3.2 Gen 2x2, WiFi 6E integrado, Dynamic OC Switcher, Ryzen Core Flex, AI Cooling II e iluminación Aura Sync RGB.",{},ROG STRIX X670E-E GAMING WIFI,"['Motherboards', 'ROG Strix']",https://rog.asus.com/ar/motherboards/rog-strix/rog-strix-x670e-e-gaming-wifi-model/,https://dlcdnwebimgs.asus.com/gain/BADFA920-702B-451B-9592-8279ACD6857B/w185,90MB1BR0-M0AAY0,R_90MB1BR0-M0AAY0
ROG STRIX Z890-F GAMING WIFI,ASUS,tarjetas madre,,,,0.0,0,"Tarjeta madre Intel &reg;  Z890 LGA 1851 ATX, Advanced AI PC-ready, 16+1+2+2 etapas de potencia, ranuras DDR5, DIMM Flex, AEMP III, WiFi 7 con ASUS WiFi Q-Antenna, cinco ranuras M.2, una ranura para SSD PCIe &reg;  5.0 NVMe &reg;  con M.2 Q-release, PCIe 5.0 x16 SafeSlot con PCIe Slot Q-Release Slim y soporte completo para tarjeta gráfica de última generación, dos puertos Thunderbolt&trade; 4, puerto de E/S trasero USB 10 Gbps Type-C &reg;  con carga rápida Power Delivery de hasta 30 vatios, NPU Boost, ASUS AI Advisor, AI Overclocking, AI Cooling II, AI Networking II y Polymo Lighting.",{},ROG STRIX Z890-F GAMING WIFI,"['Motherboards', 'ROG Strix']",https://rog.asus.com/ar/motherboards/rog-strix/rog-strix-z890-f-gaming-wifi/,https://dlcdnwebimgs.asus.com/gain/D954507C-D0F7-42C7-B0B2-4D2518E6EC9F/w185,90MB1I40-M0EAY0,R_90MB1I40-M0EAY0
ROG STRIX Z890-E GAMING WIFI,ASUS,tarjetas madre,,,,0.0,0,"Tarjeta madre Intel &reg;  Z890 LGA 1851 ATX, Advanced AI PC-ready, 18+1+2+2 fases de poder, ranuras DDR5 con tecnología NitroPath DRAM, DIMM Fit, DIMM Flex, AEMP III, WiFi 7 con ASUS WiFi Q-Antenna, siete ranuras M.2, tres ranuras SSD PCIe &reg;  5.0 NVMe &reg; , PCIe 5.0 x16 SafeSlot con PCIe Slot Q-Release Slim y soporte completo para tarjeta gráfica de última generación, dos puertos Thunderbolt&trade; 4 puertos, puerto de E/S trasero USB 10 Gbps Tipo-C &reg;  con carga rápida Power Delivery de hasta 30 vatios, NPU Boost, ASUS AI Advisor, AI Overclocking, AI Cooling II, AI Networking II y Polymo Lighting.",{},ROG STRIX Z890-E GAMING WIFI,"['Motherboards', 'ROG Strix']",https://rog.asus.com/ar/motherboards/rog-strix/rog-strix-z890-e-gaming-wifi/,https://dlcdnwebimgs.asus.com/gain/9DA9750F-E81D-4F36-B0B4-D38F07B6E8EC/w185,90MB1IM0-M0EAY0,R_90MB1IM0-M0EAY0
ROG MAXIMUS Z890 HERO,ASUS,tarjetas madre,,,,0.0,0,"Tarjeta madre Intel &reg;  Z890 LGA 1851 ATX, Advanced AI PC-ready, 22+1+2+2 fases de poder, NPU Boost, ranuras DDR5 con tecnología NitroPath DRAM, DIMM Flex, AEMP III, WiFi 7 con ASUS WiFi Q-Antenna, tres ranuras PCIe &reg;  5.0 M.2 y tres ranuras PCIe 4.0 M.2 integradas con ROG M.2 PowerBoost, conector SlimSAS, PCIe 5.0 x16 SafeSlot con PCIe Slot Q-Release Slim y soporte completo para tarjetas gráficas de última generación, dos puertos Thunderbolt&trade; 4 puertos, conector frontal USB 20 Gbps Type-C &reg;  con Quick Charge 4+ hasta 60 W y USB Wattage Watcher, ASUS AI Advisor, AI Overclocking, AI Cooling II, AI Networking II y Polymo Lighting II.",{},ROG MAXIMUS Z890 HERO,"['Motherboards', 'ROG Maximus']",https://rog.asus.com/ar/motherboards/rog-maximus/rog-maximus-z890-hero/,https://dlcdnwebimgs.asus.com/gain/616785F3-741B-4186-8262-57EF5E2B7CA3/w185,90MB1ID0-M0EAY0,R_90MB1ID0-M0EAY0
ROG STRIX X870-F GAMING WIFI,ASUS,tarjetas madre,,,,0.0,0,"Motherboard AMD X870 ATX con 16+2+2 fases de poder, Dynamic OC Switcher, Core Flex, soporte DDR5 con AEMP, WiFi 7 con ASUS WiFi Q-Antenna, cuatro puertos M.2, PCIe® 5.0 x16 SafeSlots con PCIe Slot Q-Release Slim, dos puertos USB4®, USB 10Gbps Type-C® con PD 3.0 hasta 30W, AI Overclocking, AI Cooling II, AI Networking II e iluminación Aura Sync RGB.",{},ROG STRIX X870-F GAMING WIFI,"['Motherboards', 'ROG Strix']",https://rog.asus.com/ar/motherboards/rog-strix/rog-strix-x870-f-gaming-wifi/,https://dlcdnwebimgs.asus.com/gain/8B039661-BD8B-4454-98CB-E53BBC4B3944/w185,90MB1IV0-M0AAY0,R_90MB1IV0-M0AAY0
ProArt Z890-CREATOR WIFI,ASUS,tarjetas madre,,,,4.5,100,"Tarjeta madre para creación de contenido Intel Z890 LGA1851 ATX con PCIe &reg;  5.0, ranuras DDR5, dos puertos USB4 &reg; , Ethernet 10G y 2.5G, WiFi 7, cinco ranuras M.2, además de un conector USB 20Gpbs en el panel frontal",{},Intel,"['Motherboards-Components', 'Motherboards', 'ProArt']",https://www.asus.com/ar/motherboards-components/motherboards/proart/proart-z890-creator-wifi/,https://dlcdnwebimgs.asus.com/gain/d03a59e1-5b59-4fa1-ba5d-0d9361ce0815/w185,30710,30710
TUF GAMING Z890-PLUS WIFI,ASUS,tarjetas madre,,,,4.5,100,"Tarjeta madre ATX Intel &reg;  Z890 (LGA 1851), Advanced AI PC-ready, 16+1+2+1 fases de poder DrMOS de 80A, ranuras DDR5, PCIe &reg;  5.0, DisplayPort, HDMI&trade;, puerto Thunderbolt&trade; 4 USB Type-C &reg; , puerto USB Type-C &reg;  de 20 Gbps en el panel frontal, 4 ranuras M.2, Wi-Fi 7 con Q-Antenna, Intel &reg;  2.5 Gb Ethernet, M.2 Q-Release, ranura PCIe Q-Release, protector de E/S premontado, botón BIOS FlashBack&trade;, Aura Sync",{},Intel,"['Motherboards-Components', 'Motherboards', 'TUF-Gaming']",https://www.asus.com/ar/motherboards-components/motherboards/tuf-gaming/tuf-gaming-z890-plus-wifi/,https://dlcdnwebimgs.asus.com/gain/e8c6fe24-aba5-44cf-a13e-abef2679fdd2/w185,29693,29693
PRIME Z890M-PLUS WIFI,ASUS,tarjetas madre,,,,4.5,100,"Tarjeta madre Intel &reg;  Z890 (LGA 1851) mATX, Advanced AI PC-ready, 10+1+2+1 fases de poder DrMOS de 80 A, ranuras DDR5, PCIe &reg;  5.0 x16 SafeSlot y soporte completo para tarjetas gráficas de última generación, DisplayPort, HDMI&trade;, puerto USB de 20 Gbps compatible con salida de video DisplayPort, puerto USB de 5 Gbps tipo C &reg;  en el panel frontal, 3 ranuras M.2, Wi-Fi 7 con Q-Antenna, Realtek 2.5 Gb Ethernet, protector de E/S premontado, BIOS FlashBack&trade;, Aura Sync",{},Intel,"['Motherboards-Components', 'Motherboards', 'PRIME']",https://www.asus.com/ar/motherboards-components/motherboards/prime/prime-z890m-plus-wifi/,https://dlcdnwebimgs.asus.com/gain/5625b742-4b7f-484f-befa-298662e13f68/w185,29692,29692
PRIME Z890-P WIFI,ASUS,tarjetas madre,,,,4.5,100,"Tarjeta madre ATX Intel &reg;  Z890 (LGA 1851), compatible con PC con IA avanzada, 14+1+2+1 fases de poder DrMOS de 80 A, ranura PCIe &reg;  5.0 x16 con soporte completo para tarjetas gráficas de última generación, ranuras DDR5, cuatro ranuras M.2, WiFi 7, Ethernet Realtek de 2,5 Gb, DisplayPort, HDMI&trade;, puerto Thunderbolt&trade; 4 USB Type-C &reg; , puerto USB Type-C &reg;  de 10 Gbps en el panel frontal, Aura Sync",{},Intel,"['Motherboards-Components', 'Motherboards', 'PRIME']",https://www.asus.com/ar/motherboards-components/motherboards/prime/prime-z890-p-wifi/,https://dlcdnwebimgs.asus.com/gain/755af9c8-c0ab-4640-9fe1-44545958537a/w185,29668,29668
Z890 AYW GAMING WIFI W,ASUS,tarjetas madre,,,,4.5,100,"Tarjeta madre Intel &reg;  Z890 LGA 1851 ATX, compatible con PC con IA avanzada, 12+1+2+1 fases de poder DrMOS de 80 A, ranuras DDR5, PCIe 5.0, DisplayPort, puertos USB 20 Gbps Type-C &reg;  frontales y traseros, 4 ranuras M.2, Wi-Fi 6, Ethernet Realtek de 2,5 Gb, ranura PCIe Q-Release, protector de E/S premontado, botón BIOS FlashBack&trade;, Aura Sync",{},Intel,"['Motherboards-Components', 'Motherboards', 'Others']",https://www.asus.com/ar/motherboards-components/motherboards/others/z890-ayw-gaming-wifi-w/,https://dlcdnwebimgs.asus.com/gain/fde27514-8cdd-4680-842b-f5df911cb335/w185,30699,30699
TUF GAMING X870-PLUS WIFI,ASUS,tarjetas madre,,,,4.5,100,"Motherboard AMD X870 (Socket AM5) ATX, preparada para PC con IA avanzada, 16+2+1 etapas de potencia (80A), AEMP, AI Overclocking, AI Cooling II, AI Networking II, DDR5, compatible con PCIe 5.0 para tarjetas gráficas de próxima generación, cuatro ranuras M.2, Wi-Fi 7, Ethernet Realtek de 2.5Gb, HDMI™, USB4 ®  40Gbps (Tipo-C ® ), SATA 6 Gbps, USB frontal de 20Gbps (Tipo-C ® ) con soporte de carga rápida PD, BIOS FlashBack™, Aura Sync.",{},AMD,"['Motherboards-Components', 'Motherboards', 'TUF-Gaming']",https://www.asus.com/ar/motherboards-components/motherboards/tuf-gaming/tuf-gaming-x870-plus-wifi/,https://dlcdnwebimgs.asus.com/gain/64c122cf-1bab-4bac-aa97-591e1573dd29/w185,28600,28600
ProArt X870E-CREATOR WIFI,ASUS,tarjetas madre,,,,4.5,100,"Motherboard AMD X870E Ryzen AM5 ATX para creación de contenido con PCIe® 5.0, compatibilidad con DDR5, dual USB4®, Ethernet de 10G y 2.5 Gb, WiFi 7, cuatro ranuras M.2, además de un conector USB de 20 Gbps en el panel frontal con Power Delivery 3.0 de 30 W y Quick Charge 4+.",{},AMD,"['Motherboards-Components', 'Motherboards', 'ProArt']",https://www.asus.com/ar/motherboards-components/motherboards/proart/proart-x870e-creator-wifi/,https://dlcdnwebimgs.asus.com/gain/935d02ef-5ed8-4475-aead-1bfbc3324eee/w185,28629,28629
PRIME X870-P WIFI,ASUS,tarjetas madre,,,,4.5,100,"Motherboard AMD X870 (Socket AM5) ATX, lista para PCs avanzadas con IA, con diseño de alimentación 14+2+1 DrMOS, ranura PCIe 5.0 x16 con soporte completo para tarjetas gráficas de próxima generación, ranuras DDR5, cuatro ranuras M.2, WiFi 7, Ethernet Realtek de 2.5 Gb, USB de 40 Gbps, HDMI™, USB de 10 Gbps Tipo-A, conector USB frontal de 10 Gbps Tipo-C ® , puertos SATA de 6 Gbps, cabezal USB de 5 Gbps y iluminación RGB Aura Sync.",{},AMD,"['Motherboards-Components', 'Motherboards', 'PRIME']",https://www.asus.com/ar/motherboards-components/motherboards/prime/prime-x870-p-wifi/,https://dlcdnwebimgs.asus.com/gain/64c2d66b-18b4-4df7-90ac-3e67a4255f8e/w185,28586,28586
PRIME B760M-A AX6 II,ASUS,tarjetas madre,,,,4.5,100,"Tarjeta madre Intel &reg;  B760 (LGA 1700) mATX, IA avanzada preparada para tu PC, PCIe 4.0, DDR5, tres ranuras M.2, Realtek 1 Gb Ethernet, WiFi 6, DisplayPort, HDMI&trade;, SATA 6 Gbps, USB trasero de 10 Gbps tipo A, USB frontal de 5 Gbps tipo C &reg; , Aura Sync",{},Intel,"['Motherboards-Components', 'Motherboards', 'PRIME']",https://www.asus.com/ar/motherboards-components/motherboards/prime/prime-b760m-a-ax6-ii/,https://dlcdnwebimgs.asus.com/gain/47f840e6-f935-45c7-98b1-454ec5a89448/w185,26426,26426
PRIME B650M-A AX6 II-CSM,ASUS,tarjetas madre,,,,4.5,100,"Motherboard AMD B650 Micro-ATX: Preparada para PC con IA avanzada, soporte DDR5, PCIe 5.0 M.2, WiFi 6, DisplayPort, HDMI™, SATA 6 Gbps, puertos USB traseros de 10 Gbps Type-A y Type-C ® , USB frontal de 5 Gbps Type-C ® , BIOS FlashBack™, cancelación de ruido two-way AI y Aura Sync.",{},AMD,"['Motherboards-Components', 'Motherboards', 'CSM']",https://www.asus.com/ar/motherboards-components/motherboards/csm/prime-b650m-a-ax6-ii-csm/,https://dlcdnwebimgs.asus.com/gain/0e107cc1-eae7-4bff-986b-4b34a00d85d8/w185,25412,25412
PRIME B650M-A AX6 II,ASUS,tarjetas madre,,,,4.5,100,"Motherboard AMD B650 Micro-ATX, preparada para PC avanzados con IA, DDR5, soporte PCIe 5.0 M.2, Wi-Fi 6, DisplayPort, HDMI™, SATA 6 Gbps, puertos USB posteriores de 10 Gbps Tipo-A y Tipo-C®, USB frontal de 5 Gbps Tipo-C®, BIOS FlashBack™, Cancelación de ruido two-way AI, Aura Sync.",{},AMD,"['Motherboards-Components', 'Motherboards', 'PRIME']",https://www.asus.com/ar/motherboards-components/motherboards/prime/prime-b650m-a-ax6-ii/,https://dlcdnwebimgs.asus.com/gain/3f10d0d2-bc08-4801-9fb5-386551d04ccf/w185,25409,25409
TUF GAMING B760M-PLUS WIFI II,ASUS,tarjetas madre,,,,4.5,100,"Tarjeta madre Intel &reg;  B760 (LGA 1700) mATX, compatible con PC con IA avanzada, tres ranuras M.2, 12+1 DrMOS, Ethernet Realtek de 2,5 Gb, Wi-Fi 6E, HDMI&trade;, DisplayPort, USB trasero de 20 Gbps tipo C &reg; , USB frontal de 10 Gbps Tipo-C &reg; , compatibilidad con Thunderbolt&trade; (USB4 &reg; ), Aura Sync",{},Intel,"['Motherboards-Components', 'Motherboards', 'TUF-Gaming']",https://www.asus.com/ar/motherboards-components/motherboards/tuf-gaming/tuf-gaming-b760m-plus-wifi-ii/,https://dlcdnwebimgs.asus.com/gain/7fe2d1f3-146a-4605-ac83-3bd89fb0b00b/w185,25134,25134
Pro H610M-CT2 D4-CSM,ASUS,tarjetas madre,,,,4.5,100,"Pro H610M-CT2 D4-CSM es compatible con el socket Intel &reg;  LGA1700 para procesadores Intel &reg;  de 14º, 13º y 12º generación, y está equipado con características excepcionales, que incluyen 2 x DP, VGA, compatibilidad con PCIe 4.0, DDR4 3200, USB 3.2 Gen 2, ranura M.2 PCIe 3.0, ranura M.2 key E, TPM2.0 IC integrado, núcleo Q-LED, encabezado SMBUS, ASUS Control Center Express(ACCE), ASUS Boot Defender.",{},Intel,"['Motherboards-Components', 'Motherboards', 'Business']",https://www.asus.com/ar/motherboards-components/motherboards/business/pro-h610m-ct2-d4-csm/,https://dlcdnwebimgs.asus.com/gain/90b5405e-0557-43df-a25e-eed9501d2de0/w185,22499,22499
PRIME H610M-A-CSM,ASUS,tarjetas madre,,,,4.5,100,"Tarjeta madre Intel &reg;  H610 (LGA 1700) mATX con DDR5, dos ranuras M.2, Intel &reg;  1Gb Ethernet, DisplayPort, HDMI&trade;, VGA, puertos USB 3.2 Gen 2, cabezales direccionables Gen 2 y Aura Sync",{},Intel,"['Motherboards-Components', 'Motherboards', 'CSM']",https://www.asus.com/ar/motherboards-components/motherboards/csm/prime-h610m-a-csm/,https://dlcdnwebimgs.asus.com/gain/ae9c5236-9d7c-4933-9991-201309d8a110/w185,23797,23797
PRIME H610M-A,ASUS,tarjetas madre,,,,4.5,100,"Tarjeta madre Intel &reg;  H610 (LGA 1700) mATX con DDR5, dos ranuras M.2, Intel &reg;  1Gb Ethernet, DisplayPort, HDMI&trade;, VGA, puertos USB 3.2 Gen 2, conectores direccionables Gen 2 y Aura Sync",{},Intel,"['Motherboards-Components', 'Motherboards', 'PRIME']",https://www.asus.com/ar/motherboards-components/motherboards/prime/prime-h610m-a/,https://dlcdnwebimgs.asus.com/gain/ae9c5236-9d7c-4933-9991-201309d8a110/w185,23716,23716
ProArt B760-CREATOR WIFI,ASUS,tarjetas madre,,,,4.5,100,"Tarjeta madre Intel &reg;  B760 LGA 1700 ATX diseñada para creadores, IA avanzada preparada para tu PC, PCIe &reg;  5.0, DDR5, WiFi 6, Ethernet de 2,5 Gb y 1 Gb, tres ranuras M.2, además de un conector USB 3.2 Gen 2x2 en el panel frontal con Quick Charge 4+ de 60 W",{},Intel,"['Motherboards-Components', 'Motherboards', 'ProArt']",https://www.asus.com/ar/motherboards-components/motherboards/proart/proart-b760-creator-wifi/,https://dlcdnwebimgs.asus.com/gain/44cac7f2-acb4-40a7-8d97-49e9f89b3279/w185,23718,23718
PRIME A620M-K-CSM,ASUS,tarjetas madre,,,,4.5,100,"Motherboard AMD A620 (Ryzen™ AM5) micro-ATX, lista para Advanced AI PC, DDR5, compatibilidad con tarjeta gráfica PCIe 4.0 y con PCIe 4.0 M.2, HDMI™, VGA, USB 3.2 Gen 1 Type-A, SATA de 6 Gbps, cancelación de ruido Two-Way AI, Aura Sync",{},AMD,"['Motherboards-Components', 'Motherboards', 'CSM']",https://www.asus.com/ar/motherboards-components/motherboards/csm/prime-a620m-k-csm/,https://dlcdnwebimgs.asus.com/gain/9e892470-c894-429f-be7f-53ab61483d99/w185,23686,23686
PRIME A620M-K,ASUS,tarjetas madre,,,,4.5,100,"Motherboard AMD A620 (Ryzen™ AM5) micro-ATX, lista para Advanced AI PC, DDR5, compatibilidad con tarjeta gráfica PCIe 4.0 y con PCIe 4.0 M.2, HDMI™, VGA, USB 3.2 Gen 1 Type-A, SATA de 6 Gbps, cancelación de ruido Two-Way AI, Aura Sync",{},AMD,"['Motherboards-Components', 'Motherboards', 'PRIME']",https://www.asus.com/ar/motherboards-components/motherboards/prime/prime-a620m-k/,https://dlcdnwebimgs.asus.com/gain/041d5ac0-be0d-4caf-a31a-0ffee9ab637a/w185,23684,23684
PRIME A620M-A-CSM,ASUS,tarjetas madre,,,,4.5,100,"Motherboard micro-ATX AMD A620 (Ryzen™ AM5), Advanced AI PC ready, DDR5, soporte PCIe 4.0, ranuras duales M.2, DisplayPort/HDMI™/VGA, puertos USB 3.2 Gen 1, USB 3.2 Gen 1 Tipo-C® frontal, SATA 6 Gbps, BIOS FlashBack™, Cancelación de Ruido Two-Way AI, Aura Sync",{},AMD,"['Motherboards-Components', 'Motherboards', 'CSM']",https://www.asus.com/ar/motherboards-components/motherboards/csm/prime-a620m-a-csm/,https://dlcdnwebimgs.asus.com/gain/40fa567d-d24c-4086-8284-19f75a3623bb/w185,23596,23596
TUF GAMING A620M-PLUS WIFI,ASUS,tarjetas madre,,,,4.5,100,"Motherboard micro-ATX AMD A620 (Ryzen AM5), Advanced AI PC ready, PCIe 4.0, ranuras duales M.2, 2 x DisplayPort, HDMI™, Ethernet Realtek 2.5Gb, Wi-Fi 6, USB 3.2 Gen 1 Tipo-C® frontal, SATA 6 Gbps, BIOS FlashBack™, M.2 Q-Latch, Cancelación de Ruido Two-Way AI e iluminación RGB Aura Sync.",{},AMD,"['Motherboards-Components', 'Motherboards', 'TUF-Gaming']",https://www.asus.com/ar/motherboards-components/motherboards/tuf-gaming/tuf-gaming-a620m-plus-wifi/,https://dlcdnwebimgs.asus.com/gain/362589f1-34fb-4f66-bed7-2df2c26a2b1e/w185,22557,22557
PRIME A620M-A,ASUS,tarjetas madre,,,,4.5,100,"Motherboard AMD A620 (Ryzen™ AM5) micro-ATX, lista para Advanced AI PC, DDR5, compatibilidad con PCIe 4.0, ranuras duales M.2, DisplayPort/HDMI™/VGA, puertos USB 3.2 Gen 1, USB 3.2 Gen 1 Type-C ®  frontal, SATA 6 Gbps, BIOS FlashBack™, cancelación de ruido Two-Way AI e iluminación RGB Aura Sync.",{},AMD,"['Motherboards-Components', 'Motherboards', 'PRIME']",https://www.asus.com/ar/motherboards-components/motherboards/prime/prime-a620m-a/,https://dlcdnwebimgs.asus.com/gain/d00d67ce-a8a9-4b73-9bb5-a75d4dc33ffa/w185,23588,23588
PRIME B760M-A,ASUS,tarjetas madre,,,,4.5,100,"Tarjeta madre Intel &reg;  B760 (LGA 1700) mATX, IA avanzada preparada para tu PC, PCIe 4.0, DDR5, dos ranuras M.2, Ethernet Realtek de 2,5 Gb, DisplayPort, HDMI™ dual, SATA de 6 Gbps, USB 3.2 Gen 2 trasero, USB 3.2 Gen 1 Tipo-C &reg;  frontal, Aura Sync",{},Intel,"['Motherboards-Components', 'Motherboards', 'PRIME']",https://www.asus.com/ar/motherboards-components/motherboards/prime/prime-b760m-a/,https://dlcdnwebimgs.asus.com/gain/43eaace9-b4ac-454c-b66d-696886f12dac/w185,22541,22541
PRIME B760M-A-CSM,ASUS,tarjetas madre,,,,4.5,100,"Tarjeta  madre Intel &reg;  B760 (LGA 1700) mATX, IA avanzada preparada para tu PC, PCIe 4.0, DDR5, dos ranuras M.2, Ethernet Realtek de 2,5 Gb, DisplayPort, HDMI™ dual, SATA de 6 Gbps, USB 3.2 Gen 2 trasero, USB 3.2 Gen 1 Tipo-C &reg;  frontal, Aura Sync",{},Intel,"['Motherboards-Components', 'Motherboards', 'PRIME']",https://www.asus.com/ar/motherboards-components/motherboards/prime/prime-b760m-a-csm/,https://dlcdnwebimgs.asus.com/gain/c064d96c-5695-400b-bf0d-d07c05dfed21/w185,22539,22539
PRIME B760-PLUS,ASUS,tarjetas madre,,,,4.5,100,"Placa madre Intel &reg;  B760 (LGA 1700) ATX, IA avanzada preparada para tu PC, PCIe 5.0, tres ranuras PCIe 4.0 M.2, DDR5, Ethernet Realtek de 2,5 Gb, DisplayPort, VGA, HDMI™, SATA de 6 Gbps, USB 3.2 Gen 2x2 Tipo-C &reg; , USB 3.2 Gen 1 Tipo-C &reg;  frontal, compatibilidad con Thunderbolt™ (USB4 &reg; ), Aura Sync",{},Intel,"['Motherboards-Components', 'Motherboards', 'PRIME']",https://www.asus.com/ar/motherboards-components/motherboards/prime/prime-b760-plus/,https://dlcdnwebimgs.asus.com/gain/0da56daf-48a2-474b-874d-00c5ffadca54/w185,22492,22492
TUF GAMING B760-PLUS WIFI,ASUS,tarjetas madre,,,,4.5,100,"Tarjeta madre Intel &reg;  B760 (LGA 1700) ATX, IA avanzada preparada para tu PC, DDR5, tres ranuras PCIe 4.0 M.2, 12+1 DrMOS, Ethernet Realtek de 2,5 Gb, DisplayPort, HDMI, USB 3.2 Gen 2 Tipo-C &reg;  frontal, Aura Sync, AEMP II",{},Intel,"['Motherboards-Components', 'Motherboards', 'TUF-Gaming']",https://www.asus.com/ar/motherboards-components/motherboards/tuf-gaming/tuf-gaming-b760-plus-wifi/,https://dlcdnwebimgs.asus.com/gain/bbe169d6-ee09-43c8-aaac-b01940d35422/w185,22471,22471
ProArt B760-CREATOR D4,ASUS,tarjetas madre,,,,4.5,100,"Tarjeta madre Intel &reg;  B760 LGA 1700 ATX diseñada para creadores, IA avanzada preparada para tu PC, PCIe &reg;  5.0, DDR4, Ethernet de 2,5 Gb y 1 Gb, tres ranuras M.2, además de un conector USB 3.2 Gen 2x2 en el panel frontal",{},Intel,"['Motherboards-Components', 'Motherboards', 'ProArt']",https://www.asus.com/ar/motherboards-components/motherboards/proart/proart-b760-creator-d4/,https://dlcdnwebimgs.asus.com/gain/8d0ddb26-f386-4233-a6bc-452e366be54f/w185,22421,22421
PRIME B760M-A WIFI D4,ASUS,tarjetas madre,,,,4.5,100,"Tarjeta madre Intel &reg;  B760 (LGA 1700) mATX, IA avanzada preparada para tu PC, PCIe 4.0, dos ranuras M.2, Ethernet Realtek de 2,5 Gb, Wi-Fi 6, DisplayPort, HDMI dual &reg; , SATA 6 Gbps, USB 3.2 Gen 2 trasero, USB 3.2 Gen 1 Tipo-C &reg;  frontal, Aura Sync",{},Intel,"['Motherboards-Components', 'Motherboards', 'PRIME']",https://www.asus.com/ar/motherboards-components/motherboards/prime/prime-b760m-a-wifi-d4/,https://dlcdnwebimgs.asus.com/gain/43e9c0fd-f9b4-4e45-9bdf-f14495af40b7/w185,22276,22276
PRIME B760M-A D4-CSM,ASUS,tarjetas madre,,,,4.5,100,"Tarjeta madre Intel &reg;  B760 (LGA 1700) mATX, IA avanzada preparada para tu PC, PCIe 4.0, dos ranuras M.2, Ethernet Realtek de 2,5 Gb, Wi-Fi 6, DisplayPort, HDMI dual &reg; , SATA 6 Gbps, USB 3.2 Gen 2 trasero, USB 3.2 Gen 1 Tipo-C &reg;  frontal, Aura Sync",{},Intel,"['Motherboards-Components', 'Motherboards', 'PRIME']",https://www.asus.com/ar/motherboards-components/motherboards/prime/prime-b760m-a-d4-csm/,https://dlcdnwebimgs.asus.com/gain/9c2ea59d-7564-4b22-9398-49737cd531ef/w185,22354,22354
PRIME B760M-A D4,ASUS,tarjetas madre,,,,4.5,100,"Tarjeta madre Intel &reg;  B760 (LGA 1700) mATX, IA avanzada preparada para tu PC, PCIe 4.0, dos ranuras M.2, Ethernet Realtek de 2,5 Gb, Wi-Fi 6, DisplayPort, HDMI dual &reg; , SATA 6 Gbps, USB 3.2 Gen 2 trasero, USB 3.2 Gen 1 Tipo-C &reg;  frontal, Aura Sync",{},Intel,"['Motherboards-Components', 'Motherboards', 'PRIME']",https://www.asus.com/ar/motherboards-components/motherboards/prime/prime-b760m-a-d4/,https://dlcdnwebimgs.asus.com/gain/48925aaa-88fd-4f69-9e73-3598a9c6fb1b/w185,22350,22350
PRIME B650M-A WIFI II,ASUS,tarjetas madre,,,,4.5,100,"ASUS PRIME B650M-A WIFI II: Motherboard AMD B650 (Ryzen AM5) micro-ATX, preparada para IA avanzada, soporte DDR5, dos ranuras M.2, LAN de 2.5Gb, Wi-Fi 6, DisplayPort/HDMI ® /VGA, puertos USB 3.2 Gen 2, USB 3.2 Gen 1 Type-C ®  frontal, BIOS FlashBack ™  y Aura Sync.",{},AMD,"['Motherboards-Components', 'Motherboards', 'PRIME']",https://www.asus.com/ar/motherboards-components/motherboards/prime/prime-b650m-a-wifi-ii/,https://dlcdnwebimgs.asus.com/gain/79ca946c-2d29-4721-afef-c6786868766c/w185,22403,22403
Pro B760M-CT-CSM,ASUS,tarjetas madre,,,,4.5,100,"El Pro B760M-CT-CSM es compatible con el socket LGA1700 de Intel &reg;  para procesadores Intel &reg;  de 14º, 13º y 12º generación, incluidos dos puertos de pantalla, HDMI, D-Sub, compatibilidad con PCIe 4.0, DDR5, dos ranuras M.2 PCIe 4.0, USB 3.2 Gen 1 Tipo-C &reg;  frontal, TPM IC integrado, núcleo Q-LED, encabezado de salida mono (con IC de amplificador), encabezado SMBUS, ASUS Control Center Express (ACCE), ASUS Boot Defender",{},Intel,"['Motherboards-Components', 'Motherboards', 'Business']",https://www.asus.com/ar/motherboards-components/motherboards/business/pro-b760m-ct-csm/,https://dlcdnwebimgs.asus.com/gain/f1868258-c78a-48c9-ac1c-1e9fa3fd4175/w185,22406,22406
TUF GAMING B760M-PLUS WIFI D4,ASUS,tarjetas madre,,,,4.5,100,"Tarjeta madre Intel &reg;  B760 (LGA 1700) mATX, IA avanzada preparada para tu PC, PCIe 5.0, dos ranuras M.2, 12+1 DrMOS, DDR4, Realtek 2.5Gb Ethernet, Intel &reg;  Wi-Fi 6, HDMI &reg; , DisplayPort, USB 3.2 Gen 2x2 Tipo-C &reg;  trasero, USB 3.2 Gen 1 Tipo-C &reg;  frontal, compatibilidad con Thunderbolt™ (USB4 &reg; ), Arua Sync",{},Intel,"['Motherboards-Components', 'Motherboards', 'TUF-Gaming']",https://www.asus.com/ar/motherboards-components/motherboards/tuf-gaming/tuf-gaming-b760m-plus-wifi-d4/,https://dlcdnwebimgs.asus.com/gain/dd0c089c-f1c5-45e6-9bcb-b64899e44aff/w185,22366,22366
TUF GAMING B760-PLUS WIFI D4,ASUS,tarjetas madre,,,,4.5,100,"Tarjeta madre Intel &reg;  B760 (LGA 1700) ATX, IA avanzada preparada para tu PC, tres ranuras PCIe 4.0 M.2, 12+1 DrMOS, Ethernet Realtek de 2,5 Gb, DisplayPort, HDMI, USB 3.2 Gen 2 Tipo-C &reg;  frontal, Aura Sync",{},Intel,"['Motherboards-Components', 'Motherboards', 'TUF-Gaming']",https://www.asus.com/ar/motherboards-components/motherboards/tuf-gaming/tuf-gaming-b760-plus-wifi-d4/,https://dlcdnwebimgs.asus.com/gain/7863d737-c623-4cbc-8f67-f492f6e26ad1/w185,22360,22360
PRIME Z790M-PLUS,ASUS,tarjetas madre,,,,4.5,100,"Tarjeta madre Intel Z790 (LGA 1700) mATX, IA avanzada preparada para tu PC, tres ranuras M.2, 10+1 DrMOS, DDR5, Intel &reg;  1 Gb LAN, HDMI &reg; , DP, USB 3.2 Gen 2x2 Tipo-C &reg; , USB 3.2 Gen 1 Tipo-C &reg;  frontal, compatibilidad con Thunderbolt™ (USB4 &reg; ), Aura Sync",{},Intel,"['Motherboards-Components', 'Motherboards', 'PRIME']",https://www.asus.com/ar/motherboards-components/motherboards/prime/prime-z790m-plus/,https://dlcdnwebimgs.asus.com/gain/52841042-cf69-4e1e-9e76-ae5be4f684f5/w185,22407,22407
PRIME B650M-A II-CSM,ASUS,tarjetas madre,,,,4.5,100,"ASUS PRIME B650M-A II-CSM AMD B650 (Ryzen AM5), motherboard Micro-ATX, preparada para PC avanzados con IA, soporte DDR5, dos ranuras M.2, LAN de 2.5 Gb, DisplayPort, HDMI®, VGA, puertos USB 3.2 Gen 2, USB frontal 3.2 Gen 1 Tipo-C®, BIOS FlashBack™, Aura Sync.",{},AMD,"['Motherboards-Components', 'Motherboards', 'CSM']",https://www.asus.com/ar/motherboards-components/motherboards/csm/prime-b650m-a-ii-csm/,https://dlcdnwebimgs.asus.com/gain/f3797744-004a-4a9b-8893-debc2e79c5a6/w185,22376,22376
PRIME B650M-A II,ASUS,tarjetas madre,,,,4.5,100,"ASUS PRIME B650M-A II AMD B650 (Ryzen AM5) motherboard Micro-ATX, preparada para PC avanzados con IA, soporte DDR5, dos ranuras M.2, LAN de 2.5 Gb, DisplayPort, HDMI®, VGA, puertos USB 3.2 Gen 2, USB frontal 3.2 Gen 1 Tipo-C®, BIOS FlashBack™, Aura Sync.",{},AMD,"['Motherboards-Components', 'Motherboards', 'PRIME']",https://www.asus.com/ar/motherboards-components/motherboards/prime/prime-b650m-a-ii/,https://dlcdnwebimgs.asus.com/gain/34c6bcc3-d71b-4d9e-8ffd-e83750c33cdc/w185,22370,22370
